Restaurant URL,Name,Address,Cuisine,Area,Contact Number
https://www.zomato.com/surat/nawabs-kitchen-shahpore/order,Nawab's Kitchen,"Opposite Wedding Showroom, Lalgate, Shahpore, Surat","Kebab, Chinese, North Indian, Mughlai, Biryan, Biryani",Shahpore,'+918780541112
https://www.zomato.com/surat/bhelwala-fastfood-shahpore/order,Bhelwala Fastfood,"9/1688, Opposite Patel Hub, Near Old Sai Baba Temple, Chauta Bazar, Shahpore, Surat","North Indian, Chinese, South Indian, Street Food, Fast Food, Sichua, Sichuan",Shahpore,"+919825885555, +919825859860"
https://www.zomato.com/surat/albela-cold-drink-juice-centre-shahpore/order,Albela Cold Drink & Juice Centre,"3/168, Ruwala Tekra, Parshi Street, Shahpore, Surat","Desserts, Ice Cream, Shake, Juices, Beverage, Beverages",Shahpore,"+919374966222, +919925579700"
https://www.zomato.com/surat/babubhais-sweets-shahpore/order,Babubhai's Sweets,"3/621, Navapura, Karva Road, Shahpore, Surat","Mitha, Mithai",Shahpore,'+919227978103
https://www.zomato.com/surat/babubhai-bhelwala-shahpore/order,Babubhai Bhelwala,"9/1680, Chauta Bazar, Kelapith, Lalgate, Opposite Goodluck Gali, Shahpore, Surat","Chinese, Street Food, Fast Food, South Indian, Sichua, Sichuan",Shahpore,"+919925434272, +919228383627"
https://www.zomato.com/surat/chirag-nankhatai-shahpore/order,Chirag Nankhatai,"5/1021-22, Shop 11, Taratiya Hanuman Sheri, Shahpore, Surat","Bakery, Fast Foo, Fast Food",Shahpore,'+917069171714
