Restaurant URL,Name,Address,Cuisine,Area,Contact Number
https://www.zomato.com/surat/gopal-locho-saiyedpura/order,Gopal Locho,"6/397, Manchharpura Kharadi Sheri, Surat Municipal Corporation, Saiyedpura, Surat","Gujarat, Gujarati",Saiyedpura,'+919377014000
https://www.zomato.com/surat/matka-biryani-culture-saiyedpura/order,Matka Biryani Culture,"7/4073, Laldarwaja Bazar, Near Himson House, Saiyedpura, Surat","Biryani, North India, North Indian",Saiyedpura,'+917859914565
https://www.zomato.com/surat/bhaijaan-biryani-saiyedpura/order,Bhaijaan Biryani,"302, Moon Palace, Saiyedpura, Surat","Biryani, Shawarma, Dessert, Desserts",Saiyedpura,'+919725130804
https://www.zomato.com/surat/la-pizza-93-saiyedpura/order,La-Pizza 93,"07/893-B, Ground Floor, Lalmiya Masjid Road, Saiyedpura, Surat","Pizza, Burger, Sandwich, Fast Foo, Fast Food",Saiyedpura,'+918320522761
https://www.zomato.com/surat/ag-ice-cream-parlour-saiyedpura/order,AG Ice Cream Parlour,"7/1462, Variyavi Bazar, Main Road, Saiyedpura, Surat","Ice Cream, Shake, Beverage, Beverages",Saiyedpura,'+919376169089
https://www.zomato.com/surat/punjabi-culture-saiyedpura/order,Punjabi Culture,"7/4073, Laldarwaja Bazar, Near Himson House, Saiyedpura, Surat","North India, North Indian",Saiyedpura,'+917859914565
https://www.zomato.com/surat/anam-chicken-tawa-fry-paratha-saiyedpura/order,Anam Chicken Tawa Fry & Paratha,"4/4894, Zampa Bazar, Opposite Saliya Market, Saiyedpura, Surat","North Indian, Biryani, Chines, Chinese",Saiyedpura,'+917990802355
https://www.zomato.com/surat/dubey-ji-spicy-saiyedpura/order,Dubey Ji Spicy,"401/402, Vinayk Palace, Kumbhar Sheri, Saiyedpura, Surat","Street Foo, Street Food",Saiyedpura,'+917600651389
